"business_name","status","trade_category","trade_tier","contact_name","email_address","phone","town","postcode","website_url","website_platform","website_agency","has_incumbent_agency","website_sub_segment","rating","review_count","years_on_checkatrade","business_type","company_type","employee_band","turnover_band","research_summary","notes"
"AJ Painting and Decorating (Amanda Johns)","Researched with website","Painter & Decorator","Tier 2",,"info@amandajohns-painting.co.uk","07711902071","Taunton","TA1 2HR","https://www.amandajohnspaintinganddecoratingservice.com/","Unknown",,"0","Unknown","5","16",,"Unknown","ltd",,,"Based on my research, here's a focused brief on AJ Painting and Decorating (Amanda Johns):

Amanda Johns Painting & Decorating Services is a friendly, professional company of painters and decorators based in Taunton that has been providing customers with high-quality finishes for over seven years. Customer reviews consistently highlight exceptional service delivery, with clients praising Amanda's work ethic, willingness to go above and beyond (including helping reassemble furniture), and reliability, prompting repeat bookings and strong recommendations. The business maintains a 100% recommend rating on Facebook with positive customer reviews. The most compelling reason for a professional website is to capture local demand: currently Amanda relies heavily on third-party directories (TrustATrader, Facebook, MyBuilder) and cannot directly showcase her portfolio, collect leads independently, or control her online narrative—a dedicated website would allow her to display before-and-after project photos, manage pricing transparency, and redirect the customer inquiry funnel away from platform fees.","Google Maps: https://www.google.com/maps/search/?api=1&query=AJ%20Painting%20and%20Decorating%20(Amanda%20Johns)&query_place_id=ChIJMzURRPP1bUgRFqUUwsCpcPw"
"AMG Carpentry & kitchens","Researched with website","Carpenter / Joiner",,,"amgcarpentry@outlook.com","07920098986","https://www.bing.com/maps/default.aspx?v=2&pc=FACEBK&mid=8100&FORM=FBKPL1&mkt=en-US",,"https://www.amgcarpentryandkitchens.co.uk/","Unknown","spf.stackmail","1","Agency-managed",,"0",,"Unknown","ltd",,,"I appreciate your interest, but I'm unable to complete this research task. The URL you've provided is a generic Bing Maps default page rather than a specific business location, so I can't identify which particular AMG Carpentry & Kitchens location you're referring to. 

To help you effectively, I would need:
- The specific city/location of the business
- Or a direct link to their Google Business profile, Facebook page, or current website

Once you provide the specific location details, I can search for information about their services, trading history, reviews, and online presence to write that research brief.","Facebook: https://www.facebook.com/amgcarpentry83/"
"AP Plastering","Researched with website","Plasterer","Tier 2",,"applaster@hotmail.com","07543901356",,,"https://applastering.co.uk/","Unknown",,"0","Unknown","100","0",,"Unknown","ltd",,,"I'd be happy to help research AP Plastering, but I notice the location information is missing from your request. Could you please provide the city and country/region where AP Plastering is based? This will help me find the correct business and provide accurate information about them.","Facebook: https://www.facebook.com/applastering12/
Rating: 100"
"ARC Plumbing | Cheltenham","Researched with website","Plumber","Tier 3",,"arcplumbinguk@gmail.com","07764890046","Cheltenham","GL53 0LF","https://arcplumbing.co.uk","Unknown","emailsrvr.com","1","Agency-managed",,"0",,"Unknown","ltd",,,"I cannot find specific information about ""ARC Plumbing"" based in Cheltenham, GL53 0LF, UK in the search results. The search returned results for ARC Plumbing companies in North Carolina (USA), Australia, and general guidance on Google Business Profiles for plumbers, but no direct information about the specific UK-based business you requested. I found one reference to ""Arc Construction (Cheltenham) Ltd"" with a GL53 postcode address, but this appears to be a construction company rather than a plumbing business.

Without being able to locate verified information about this specific plumbing business—including their services, trading history, online reviews, or owner details—I cannot produce the research brief as requested.","Facebook: https://www.facebook.com/people/ARC-Plumbing/61586761478965/"
"Ace Comfort Cooling Ltd","Researched with website","Plumber",,"Mr James Price","james@acecc.co.uk",,"Stroud","GL6 7DA","https://acecc.co.uk","Unknown","eu-sender.zohobooks","1","Agency-managed",,,,"Corporate - Ltd","ltd","1-5","< £100k","---

RESEARCH BRIEF: ACE COMFORT COOLING LTD

Ace Comfort Cooling Ltd is a privately limited company incorporated on 31 October 2007, making them an 18-year-old, well-established operation. The company is a full-service AC provider that installs and maintains efficient air conditioning units and systems for homes and businesses in the South West of England, based in Stroud, Gloucestershire. Reviews consistently highlight their professionalism and responsiveness as clearly better than rivals, with customers praising their quick response to website queries and direct contact via phone, email and text throughout the process. The most compelling case for a professional website is that while their existing site (acecc.co.uk) exists, competitor visibility and lead capture could be dramatically improved through modernised design, optimised booking system integration, and structured reviews management—currently their Cylex profile shows no reviews collected despite strong Google testimonials, representing significant lead leakage in an increasingly search-driven local market.",
"All Trade Property Services Limited","Researched with website","Builder",,"Mr Gareth Archer","archer@all-trade.co.uk",,"Bristol","BS7 9JR","https://www.alltrade.co.uk","Unknown","spf.protection","1","Agency-managed",,,,"Corporate - Ltd","ltd","1-5","< £100k","RESEARCH BRIEF: All Trade Property Services Limited

All Trade Property Services is an established and experienced maintenance, construction, renovation and repair company specialising in providing all the trades and services required for homeowners and landlords, with a comprehensive service portfolio spanning bathroom design and installation, electrical installation, plumbing and heating, roofing, extensions and new builds, and numerous other trades. The company has been building and maintaining properties since 2004, growing from a one-man operation into a team with maintenance contracts across Bristol. Their online presence shows strong customer satisfaction—reviewers highlight their ""one-stop-shop"" value with clients praising responsive office staff like Sharif and punctual technicians like Wayne and Mo. The most compelling case for a professional website is evident in their fragmented digital footprint: while they have an active website, their reviews are scattered across multiple platforms (Arrivala, Construction.co.uk, Checkatrade, Yell) where some profiles have zero reviews or are unclaimed, creating inconsistency that undermines their established 20+ year reputation and ability to capture leads from customers searching for multi-trade builders in the Southwest region.",
"Avalon Roofing | Warminster","Researched with website","Roofer",,,"owen.avalon@hotmail.com","07843538864","Warminster","BA12 6DD","https://avalonroofing.co.uk/","Unknown","ukc-smtp.co","1","Agency-managed",,"0",,"Unknown","ltd",,,"Based on my research, I can now provide you with a focused brief on Avalon Roofing | Warminster:

---

Avalon Roofing is a family run roofing contractor serving Wiltshire, Dorset and Somerset, offering residential and commercial roofing solutions across the South West. The business maintains an active Facebook presence with 341 likes and an 88% recommendation rate based on 8 reviews, indicating solid local engagement. The most compelling reason they'd benefit from a professional website is the current heavy reliance on phone contact (0784 3538864) and Facebook as their primary customer discovery channels—a limiting approach when many local homeowners searching ""roofer near Warminster"" or ""roof repairs BA12"" would expect to find a dedicated site with project galleries, detailed service offerings, customer testimonials, and online quote requests, especially given the competitive roofing market in their region where competitors like CH Roofing and LH Roofing have established web presences.

---","Facebook: https://www.facebook.com/avalon.roofing/
Rating: 88"
"B&F Construction Ltd","Researched with website","Builder",,,"ContactUs@bf-construction.co.uk","07498955069","Salisbury",,"https://bf-construction.co.uk/","Unknown","spf.em","1","Agency-managed",,"24",,,"ltd",,,"B&F CONSTRUCTION LTD - RESEARCH BRIEF

B&F Construction provides construction, landscaping, plastering, fencing, groundwork, plumbing, carpentry, painting & decorating, and general maintenance for domestic and commercial clients. The company has over 30+ years of working experience in and around Wiltshire, though their current registered entity was incorporated on 22 November 2022. Online reviews highlight excellent communication, high-quality workmanship, reliability, quick response, cleanliness, and efficiency in handling various construction and repair tasks, with a 100% recommendation rating on Facebook from 7 reviews. The most compelling reason for a professional website upgrade is the disconnect between their strong reputation and fragmented online presence: they currently rely on third-party directories, an outdated website, and scattered social media posts to demonstrate their portfolio and 30+ years of expertise, meaning a dedicated showcase of completed projects and client testimonials would directly convert their word-of-mouth reputation into measurable inquiry and lead generation.","Imported from Google Maps test run dataset_merge-dedup-transform-datasets-task-google-places_2026-04-06_09-53-23-420.json"
"Bespoke Installations SW Limited","Researched with website","Electrician",,"Mr Michael Blake","michael@bespoke.biz",,"Tiverton","EX16 4PN","https://www.bespokeinstallations.com","Parked",,"0","Unknown",,,,"Corporate - Ltd","ltd","1-5","< £100k","Bespoke Installations SW Limited specializes in smart home technology installation across the South West and London, with over 23 years of experience, though they also offer home cinema, rural broadband, WiFi, and smart audio, lighting, and heating services. The company has been trading as a private limited entity since September 2008, though their founder's hands-on experience dates back further. The most notable signal from their online presence is a significant credibility gap: they have zero reviews across multiple business directories, and invitation prompts asking customers to be the first to review them appear repeatedly, despite having a functional website and active social media. Their most compelling need for a professional website upgrade is lead conversion and credibility—their current site lacks visible testimonials, client case studies, or trust signals that would persuade affluent homeowners investing in high-end smart home systems to choose them over competitors with established review records, making a case study-rich, testimonial-driven redesign essential to converting their niche market advantage into new business.",
"Bikini Bathrooms Ltd","Researched with website","Bathroom Fitter",,,"info@bikinibathrooms.co.uk","01452387178","Gloucester","GL1 1AJ","https://bikinibathrooms.co.uk/","Unknown","spf.myukcloud","1","Agency-managed",,"61",,,"ltd",,,"Bikini Bathrooms Ltd provides comprehensive bathroom and kitchen supply, design, and installation services across Gloucestershire, with over 30 years of trading experience spanning three generations. The company maintains strong customer satisfaction with a Google rating of 4.2 out of 5 stars from 52 reviews, with customer feedback highlighting that they are ""head and shoulders above the rest"" for not pressuring unnecessary spending and listening carefully to requirements. As a small family business competing against larger retailers, Bikini differentiates itself through consistent service quality, employing skilled in-house installers with direct fitting experience who understand both the installation and sales sides of the business. The most compelling reason they'd benefit from a professional website is their heavy reliance on showroom visits and word-of-mouth despite competitive pressure; a dynamic, portfolio-driven website showcasing before-and-afters, detailed accessibility features (including specialist wetroom installations), and customer testimonials would extend their reach beyond the four-mile catchment area currently limiting their visibility to customers outside their immediate Gloucester and Monmouth locations.","Imported from Google Maps test run dataset_merge-dedup-transform-datasets-task-google-places_2026-04-06_09-53-23-420.json"
"Blue Flame Services | Bristol","Researched with website","Gas Engineer / Boiler Installer","Tier 3",,"info@blueflameservice.co.uk","01179600296","United Kingdom","BS16 3RA","https://www.instagram.com/blueflameservicesbristol/","Unknown","facebookmail.com","1","Agency-managed","98","0",,"Unknown","ltd",,,"Blue Flame Services provides comprehensive boiler installation, maintenance, and repairs, alongside bathroom and kitchen design and fitting services, operating in the Bristol area since 2000. With over 24 years of experience and 2,500+ boiler installations completed, they are accredited installers for major brands including Baxi, Worcester, Vaillant, and Viessmann. Customers consistently praise the company for reliable and friendly service, highlighting the punctuality and professionalism of staff—particularly Jason—along with exceptional bathroom design work, good value, and thorough follow-up. The most compelling reason for a professional website is that they highlight 2-hour appointment slots as a competitive advantage, yet their online presence remains fragmented across multiple directories and platforms rather than consolidated on a single authoritative branded site that could communicate this unique service proposition and convert local search traffic into qualified leads more effectively.","Facebook: https://www.facebook.com/blueflameservice/
Rating: 98"
"Boswell Roofing","Researched with website","Roofer","Tier 2","Daryl","boswellroofing@outlook.com","07487650974","kidlington",,"https://www.boswellroofing.co.uk/","Unknown",,"0","Unknown","100","0",,"Unknown","ltd",,,"Boswell Roofing is an independent roofing company based in Oxfordshire, owned and managed by Daryl Boswell and his team, providing all aspects of roofing and maintenance at a highly qualified level. The owner specialises in sarnafil, iko, and bauder flat roofing systems and brings 16 years of roofing experience, with the company incorporated on 14 January 2015. The business comes highly recommended for honest and efficient service, praised for integrity and focusing on specific job needs rather than upselling unnecessary services. A professional website would allow them to better capitalise on their strong reputation by improving local SEO visibility, enabling homeowners searching ""roofer near me"" in Kidlington and Oxfordshire to discover them organically rather than relying solely on word-of-mouth and manual outreach.","Facebook: https://www.facebook.com/p/Boswell-Roofing-100083116221122/
Rating: 100"
"Canford Plumbing And Heating","Researched with website","Plumber","Tier 3",,"canfordplumbing@gmail.com","01202366380","Dorset",,"https://www.instagram.com/canfordplumbing/","Unknown","facebookmail.com","1","Agency-managed","100","0",,"Unknown","ltd",,,,"Facebook: https://www.facebook.com/CanfordPlumbingAndHeating/
Rating: 100"
"Clarkes Windows Limited","Researched with website","Other",,"Ms Alison Clarke","alison@clarkeswindows.com",,"Dorchester","DT1 1RX","https://www.clarkeswindows.com","Unknown","spf.protection","1","Agency-managed",,,,"Corporate - Ltd","ltd","1-5","< £100k","RESEARCH BRIEF: CLARKES WINDOWS LIMITED

Clarkes Windows Limited is a local family-run double glazing installation company based in Dorchester that provides double glazing, doors, window repairs, bi-fold doors, sash windows, composite doors, and related services across multiple Dorset postcodes. The company was established in 2009 but has over 30 years of experience in the industry. Reviews on Which? Trusted Traders are highly positive, with 160 verified reviews and 99% of customers recommending them, consistently praising their efficiency, professionalism, and quality workmanship. Despite this strong reputation and active website, Clarkes Windows would benefit significantly from a more prominent digital presence and SEO optimization—their Yell listing shows zero reviews while their Which? Trusted Traders profile demonstrates exceptional customer satisfaction, yet many searchers likely land on outdated directory entries or competitors' pages first, leaving potential revenue on the table from local searches for ""double glazing Dorchester"" and related queries.","SIC: 43342 Glazing / 43390 Other building completion and finishing"
"Coastal Decor","Researched with website","Painter & Decorator","Tier 2","Kenneth","glenn.coastaldecor@yahoo.com","07759253284",,,"https://www.coastaldecor.co.uk/","Unknown","spf.web","1","Agency-managed",,"0",,"Unknown","ltd",,,"Coastal Decor is a well-established professional painting and decorating business providing comprehensive decorating services throughout Ayrshire, with a reputation for quality, dependable and friendly service at affordable prices. The business draws a high percentage of repeat customers and referrals, and based on the Companies House incorporation date provided, they have been trading for approximately 2 years since March 2024. Evidence suggests the business maintains an active online presence, though specific review information from major platforms such as Google Business Profile or Checkatrade could not be located during this research. A professional website would be the single most compelling investment for Coastal Decor, as most customers find and research local businesses on Google, with Google Search and Google Maps taking first and second positions for trusted local search platforms, enabling them to capture significantly more lead generation and establish stronger online credibility in a competitive trade market.","Facebook: https://www.facebook.com/p/Coastal-Decor-61580803855235/"
"Construction Edge | Swindon","Researched with website","Builder",,,"info@construction-edge.co.uk","03338880022","Swindon",,"https://www.construction-edge.co.uk/","Unknown","z4.zpos","1","Agency-managed",,,,,"ltd",,,"Construction Edge specialises in comprehensive construction services including general building work, painting & decorating, landscaping, plumbing, plastering, electrics, brickwork, extensions, loft conversions and full home renovations across Swindon and the surrounding area. The team has over 35 years of combined experience within the building and construction industry. Reviews from Yell highlight consistently professional workmanship with competitive quotations, budgets respected, and positive feedback describing bathroom renovations as ""OUTSTANDING"" and first-class work. With a strong reputation but a basic website that relies heavily on phone and email contact (with obfuscated email addresses), Construction Edge would significantly benefit from a professional site featuring project portfolio galleries, online quote request forms, and clear service pages that allow prospective customers in the competitive Swindon market to easily verify credentials and submit inquiries without friction.","Imported from Facebook test run dataset_dedup-datasets_2026-04-06_09-45-10-565.json"
"Cotswold Valley Kitchens","Researched with website","Kitchen Fitter",,,"info@cotswoldvalleykitchens.com","01453605604","Stroud","GL5 4SP","https://www.cotswoldvalleykitchens.com","Unknown",,"0","Unknown",,"21",,,"ltd",,,"Cotswold Valley Kitchens is a family-run kitchen company based in Stroud that designs and builds bespoke kitchens across the Cotswolds, working with customers in Gloucestershire, Wiltshire, Bristol and Oxfordshire. The company was co-founded in 2022, making it relatively new, though <ancite index=""9-6"">the founder Rob has 14 years of professional experience in kitchen crafting and installation</cite>, backed by <cite index=""3-7"">over 60 years of combined family craftsmanship</cite>. They are rated 5 stars across every review and maintain strong social proof, with <cite index=""13-6"">100% recommendation on Facebook with 15 reviews</cite>. The most compelling reason they'd benefit from a professional website is their heavy reliance on Facebook as a primary communication channel and their existing website's basic layout—combined with their premium positioning and use of immersive VR technology in design consultations, a strategically optimized website would capture high-intent search traffic from affluent homeowners searching for bespoke kitchen installers across the multi-county region they serve, where local SEO dominance would directly translate to qualified leads.","Imported from Google Maps test run dataset_merge-dedup-transform-datasets-task-google-places_2026-04-06_09-53-23-420.json"
"David Hancock Handyman","Researched with website","Landscaper / Garden Designer",,,"contact@dchancock.co.uk","07759032020","Westbury","BA13 3UW","dchancock.co.uk","Unknown",,"0","Unknown",,"3",,,"ltd",,,"David Hancock Handyman has been operating for over 10 years, offering a wide range of services across Wiltshire and Somerset. After training as a landscaper, he started his own business to provide a more personal and dependable service, and specializes in fencing, porcelain patios, artificial grass installation and interior repainting. Customer reviews highlight his polished finishing work and reputation for honesty and professionalism, though his online presence is currently limited to a basic website (dchancock.co.uk) and Facebook page. Despite strong word-of-mouth credentials and direct client testimonials, the absence of comprehensive review profiles on major platforms like Trustpilot, Rated People, or Google Reviews represents a significant opportunity—a professional website with integrated client reviews and service portfolio galleries would dramatically improve local discoverability and help him compete more visibly against the numerous other handymen in the BA13 postcode area.","Imported from Google Maps test run dataset_merge-dedup-transform-datasets-task-google-places_2026-04-06_09-53-23-420.json"
"Dorset Drainage Solutions","Researched with website","Plumber","Tier 3",,"dorsetdrainagesolutions@gmail.com","07925612387",,,"https://www.dorsetdrainage.co.uk/","Unknown",,"0","Unknown",,"0",,"Unknown","ltd",,,,"Facebook: https://www.facebook.com/DorsetDS/"
"EJB Plumbing & Heating Cheltenham","Researched with website","Gas Engineer / Boiler Installer","Tier 3","Raymond","raymondbrown07@msn.com","07425062919",,,"https://www.ejbheating.com","Unknown","spf.hostns","1","Agency-managed",,"0",,"Unknown","ltd",,,"EJB Plumbing & Heating Limited (SC379756) specialises in plumbing, heat and air-conditioning installation and has been incorporated since 4 June 2010, giving them 16 years of trading history. The company is a Gas Safe registered plumbing firm offering a wide range of services from repairs to new system installations, providing free advice on heating system upgrades and efficiency improvements. Led by Raymond, the business is highly praised for responsiveness, professionalism, and efficiency; customers appreciate their ability to accommodate short notice requests, deliver high-quality work with excellent aftercare, and their friendly, knowledgeable, reasonably priced service. The single most compelling reason EJB would benefit from a professional website is to capture online visibility in an increasingly digital market—their current online presence appears limited despite having an active Facebook page with 162 likes and a basic contact page, meaning a modern website could significantly enhance their ability to generate local leads and compete with better-optimized competitors in the plumbing and heating sector.","Facebook: https://www.facebook.com/p/EJB-Plumbing-Heating-Cheltenham-61572326920643/"
"Ei Projects Limited","Researched with website","Electrician",,"Mr Brett Edbrook","brett@eiprojects.co.uk",,"Bournemouth","BH11 8LW","https://www.eiprojects.co.uk","Wix","spf.protection","1","Agency-managed",,,,"Corporate - Ltd","ltd","1-5","< £100k","Based on my research, I need to clarify that there appears to be some confusion about Ei Projects Limited. EI Projects is a commercial interior design and fit-out company that manages projects of all sizes from concept to completion across the UK, not primarily an electrician (though electrical installation is listed as their SIC code). The company was incorporated on 2 September 2009, giving them approximately 15 years of trading history. A critical finding is that the company has no reviews on business directories, suggesting minimal online visibility despite operating for over a decade. The most compelling reason they'd benefit from a professional website is to establish credibility and showcase their commercial fit-out portfolio to UK-wide clients—currently they have virtually no searchable online presence despite competing in a specialized sector where portfolio visibility directly influences client acquisition.",
